{
  "schema_version": 5,
  "status": "ready",
  "checklist_id": "I3-RUNNER-WIN",
  "task_id": "I3-RUNNER-WIN-001",
  "profile": "strong",
  "executor": "codex",
  "command_executor": "worker-direct",
  "requested_model": "gpt-5.6-sol",
  "actual_model": "gpt-5.6-sol",
  "model_identity_source": "explicit-cli-selection",
  "permission_profile": "development",
  "requested_sandbox": "workspace-write",
  "effective_sandbox": "workspace-write",
  "environment": "windows",
  "capability_evidence_id": "sha256:aaaaaaaaaaaaaaaaaaaaaaaaaaaaaaaaaaaaaaaaaaaaaaaaaaaaaaaaaaaaaaaa",
  "capability_evidence_path": "C:\\tmp\\ficant-evidence\\capabilities\\sha256-aaaaaaaaaaaaaaaaaaaaaaaaaaaaaaaaaaaaaaaaaaaaaaaaaaaaaaaaaaaaaaaa.json",
  "base_sha": "8c4e9a0e553f093ebeec4e448865b64e783bb4cf",
  "candidate_sha": "8c4e9a0e553f093ebeec4e448865b64e783bb4cf",
  "candidate_state": "verified-diff",
  "candidate_diff_sha256": "bbbbbbbbbbbbbbbbbbbbbbbbbbbbbbbbbbbbbbbbbbbbbbbbbbbbbbbbbbbbbbbb",
  "changed_files": ["deploy/execution/windows-runner.ps1"],
  "commands": [{ "kind": "green", "argv": ["pwsh", "-NoProfile"], "cwd": "C:\\git\\ficant\\worktrees\\i3-windows-recovery", "exit_code": 0, "duration_ms": 5, "expected_tests": 1, "observed_tests": 1 }],
  "tests": { "passed": 1, "failed": 0, "skipped": 0, "total": 1 },
  "evidence_path": "C:\\tmp\\ficant-evidence",
  "evidence": [{ "path": "C:\\tmp\\ficant-evidence\\command.json", "sha256": "cccccccccccccccccccccccccccccccccccccccccccccccccccccccccccccccc" }],
  "recovery": { "correction_budget": 2, "correction_cycles_used": 0, "events": [] },
  "escalated": false,
  "escalation_reason": null,
  "blockers": [],
  "summary": "bounded candidate",
  "timings": { "model_execution_ms": 0, "runner_validation_ms": 5, "total_ms": 5 },
  "cleanup": { "temporary_paths_removed": true, "worktree_state_recorded": true }
}
